<?xml version="1.0" encoding="UTF-8"?>
<prodotti xmlns:xsi="http://www.w3.org/2001/XMLSchema-instance" xsi:noNamespaceSchemaLocation="prodotto.xsd">
    <prodotto>
        <id>1</id>
        <name>Smartphone Ultra 5G</name>
        <category>smartphone</category>
        <price>699.00</price>
        <stock>10</stock>
        <image>https://pisces.bbystatic.com/prescaled/500/500/image2/BestBuy_US/images/products/c379ba4c-68af-4410-95ba-c739979192f7.jpg</image>
        <descrizione>Uno smartphone potentissimo con fotocamera da 108MP e batteria a lunga durata.</descrizione>
    </prodotto>
    <prodotto>
        <id>2</id>
        <name>Laptop Pro 15"</name>
        <category>laptop</category>
        <price>1299.00</price>
        <stock>5</stock>
        <image>https://pisces.bbystatic.com/prescaled/500/500/image2/BestBuy_US/images/products/668bcd83-acec-4885-8450-322470fb3598.jpg</image>
        <descrizione>Processore i9, 16GB RAM, SSD 1TB. Perfetto per il lavoro pesante.</descrizione>
    </prodotto>
    <prodotto>
        <id>3</id>
        <name>Cuffie Wireless Noise Cancelling</name>
        <category>audio</category>
        <price>199.00</price>
        <stock>15</stock>
        <image>https://i2.adis.ws/i/Argos/8496609_R_Z001A</image>
        <descrizione>Isolati dal mondo con la cancellazione attiva del rumore. Autonomia 30h.</descrizione>
    </prodotto>
    <prodotto>
        <id>4</id>
        <name>Smartwatch Sport Fitness</name>
        <category>wearable</category>
        <price>89.00</price>
        <stock>20</stock>
        <image><![CDATA[https://target.scene7.com/is/image/Target/GUEST_3c3f1429-e571-4558-93cb-8154218453fd?wid=1000&hei=1000]]></image>
        <descrizione>Monitora il tuo battito cardiaco, i passi e il sonno. Resistente all'acqua.</descrizione>
    </prodotto>
</prodotti>